{
  "$schema": "dovastash-layout-1",
  "name": "Tundra Homestead",
  "note": "Each container takes the item categories listed (see Categories/00_Default.json); ignored ones are never used. Anything without a container of its own goes to the master, the chest. One setup for the whole home: the house and the cellar. From another area, only containers that always stay loaded are used. In the cellar the master is out of reach: what has no container there goes to the cellar's chest.",
  "author": "Dova Stash",
  "version": "1.1.0",
  "priority": 0,
  "requires": ["Skyrim.esm", "Update.esm", "ccEEJSSE001-Hstead.esm"],
  "replaces": ["Templates/CreationClub/TundraHomesteadCellar.json"],
  "cell": "ccEEJSSE001-Hstead.esm|0x0000087F",
  "cells": [
    {"cell": "ccEEJSSE001-Hstead.esm|0x00000B06", "label": "Cellar", "master": "ccEEJSSE001-Hstead.esm|0x00000F85"}
  ],
  "master": "ccEEJSSE001-Hstead.esm|0x00084A88",
  "containers": [
    {"ref": "ccEEJSSE001-Hstead.esm|0x00000A65", "label": "Ingredients cupboard (alchemy corner)",     "categories": ["alchemy.ingredients"]},
    {"ref": "ccEEJSSE001-Hstead.esm|0x0000098D", "label": "Apothecary's satchel (by the alchemy lab)", "categories": ["alchemy.potions", "alchemy.poisons"]},
    {"ref": "ccEEJSSE001-Hstead.esm|0x00000908", "label": "Alchemy corner cupboard",                   "categories": ["misc.animal_parts"]},
    {"ref": "ccEEJSSE001-Hstead.esm|0x00000A3C", "label": "Shrine cupboard (by the enchanter)",        "categories": ["soulgems.*"]},
    {"ref": "ccEEJSSE001-Hstead.esm|0x00000AC0", "label": "Chest (by the arcane enchanter)",           "categories": ["books.spelltomes", "scrolls"]},
    {"ref": "ccEEJSSE001-Hstead.esm|0x00000AAC", "label": "Enchanter cupboard",                        "categories": ["keys"]},
    {"ref": "ccEEJSSE001-Hstead.esm|0x00000B04", "label": "Safe",                                      "categories": ["armor.jewelry", "misc.gems", "misc.curios"]},
    {"ref": "ccEEJSSE001-Hstead.esm|0x00000B10", "label": "Sitting room cupboard",                     "categories": ["books.skill", "books.notes", "books.other"]},
    {"ref": "ccEEJSSE001-Hstead.esm|0x00000FEF", "label": "Kitchen low cupboard",                      "categories": ["alchemy.food"]},
    {"ref": "ccEEJSSE001-Hstead.esm|0x00000FAF", "label": "Bedroom dresser",                           "categories": ["armor.clothing"]},
    {"ref": "ccEEJSSE001-Hstead.esm|0x00000FBA", "label": "Bedroom cupboard",                          "categories": ["armor.heavy", "armor.light", "armor.shields", "weapons.*", "ammo.*"]},
    {"ref": "ccEEJSSE001-Hstead.esm|0x0000098F", "label": "Small chest (sitting room)",                "categories": ["misc.ores_ingots", "misc.hides_pelts"]},
    {"ref": "ccEEJSSE001-Hstead.esm|0x00000A1D", "label": "Sitting room strong box",                   "categories": ["misc.dwemer", "misc.tools", "misc.building_materials"]},
    {"ref": "ccEEJSSE001-Hstead.esm|0x0000089B", "label": "Bookshelf (by the master chest)",           "ignored": true, "note": "Scripted bookshelf: it only holds books and hands everything else back."},
    {"ref": "ccEEJSSE001-Hstead.esm|0x000008BB", "label": "Bookshelf (by the master chest, 2)",        "ignored": true, "note": "Scripted bookshelf: it only holds books and hands everything else back."},
    {"ref": "ccEEJSSE001-Hstead.esm|0x000008D5", "label": "Bookshelf (by the master chest, 3)",        "ignored": true, "note": "Scripted bookshelf: it only holds books and hands everything else back."},
    {"ref": "ccEEJSSE001-Hstead.esm|0x000008F5", "label": "Bookshelf (by the bedroom dresser)",        "ignored": true, "note": "Scripted bookshelf: it only holds books and hands everything else back."},
    {"ref": "ccEEJSSE001-Hstead.esm|0x00000F87", "label": "Cellar safe (by the mannequins)",           "categories": ["weapons.*", "ammo.*"]},
    {"ref": "ccEEJSSE001-Hstead.esm|0x00000D1B", "label": "Cellar bookcase (by the mannequin)",        "categories": ["books.*"]},
    {"ref": "ccEEJSSE001-Hstead.esm|0x00000D5C", "label": "Cellar bookcase (by the mannequin, 2)",     "categories": ["armor.heavy", "armor.light", "armor.shields"]},
    {"ref": "ccEEJSSE001-Hstead.esm|0x00000DBB", "label": "Cellar bookcase (by the mannequin, 3)",     "categories": ["misc.gems", "misc.curios", "armor.jewelry"]},
    {"ref": "ccEEJSSE001-Hstead.esm|0x000009D1", "label": "Bookshelf (by the cellar bookcase)",        "ignored": true, "note": "Scripted bookshelf: it only holds books and hands everything else back."},
    {"ref": "ccEEJSSE001-Hstead.esm|0x00000C40", "label": "Bookshelf (by the cellar bookcase, 2)",     "ignored": true, "note": "Scripted bookshelf: it only holds books and hands everything else back."}
  ],
  "displays": [
    {"ref": "ccEEJSSE001-Hstead.esm|0x0000089B", "label": "Bookshelf (by the master chest)"},
    {"ref": "ccEEJSSE001-Hstead.esm|0x000008BB", "label": "Bookshelf (by the master chest, 2)"},
    {"ref": "ccEEJSSE001-Hstead.esm|0x000008D5", "label": "Bookshelf (by the master chest, 3)"},
    {"ref": "ccEEJSSE001-Hstead.esm|0x000008F5", "label": "Bookshelf (by the bedroom dresser)"},
    {"ref": "ccEEJSSE001-Hstead.esm|0x00000828", "label": "Weapon plaque (by the cellar bookcase)"},
    {"ref": "ccEEJSSE001-Hstead.esm|0x0000082B", "label": "Weapon plaque (by the cellar bookcase, 2)"},
    {"ref": "ccEEJSSE001-Hstead.esm|0x00000835", "label": "Weapon plaque (by the master chest)"},
    {"ref": "ccEEJSSE001-Hstead.esm|0x00000836", "label": "Weapon plaque (by the master chest, 2)"},
    {"ref": "ccEEJSSE001-Hstead.esm|0x000009D1", "label": "Bookshelf (by the cellar bookcase)"},
    {"ref": "ccEEJSSE001-Hstead.esm|0x00000B12", "label": "Mannequin (by the master chest)"},
    {"ref": "ccEEJSSE001-Hstead.esm|0x00000B1B", "label": "Shield rack (by the cellar bookcase)"},
    {"ref": "ccEEJSSE001-Hstead.esm|0x00000B20", "label": "Dagger rack (by the master chest)"},
    {"ref": "ccEEJSSE001-Hstead.esm|0x00000B2F", "label": "Mannequin (by the cellar bookcase)"},
    {"ref": "ccEEJSSE001-Hstead.esm|0x00000B30", "label": "Left weapon rack (by the cellar safe)"},
    {"ref": "ccEEJSSE001-Hstead.esm|0x00000B35", "label": "Left weapon rack (by the cellar bookcase)"},
    {"ref": "ccEEJSSE001-Hstead.esm|0x00000B45", "label": "Dagger rack (by the master chest, 2)"},
    {"ref": "ccEEJSSE001-Hstead.esm|0x00000B57", "label": "Weapon rack (by the cellar safe)"},
    {"ref": "ccEEJSSE001-Hstead.esm|0x00000C40", "label": "Bookshelf (by the cellar bookcase, 2)"},
    {"ref": "ccEEJSSE001-Hstead.esm|0x00000C49", "label": "Shield rack (by the cellar safe)"},
    {"ref": "ccEEJSSE001-Hstead.esm|0x00000C58", "label": "Mannequin (by the cellar safe)"},
    {"ref": "ccEEJSSE001-Hstead.esm|0x00000C59", "label": "Mannequin (by the cellar safe, 2)"},
    {"ref": "ccEEJSSE001-Hstead.esm|0x00000C5C", "label": "Mannequin (by the cellar bookcase, 2)"},
    {"ref": "ccEEJSSE001-Hstead.esm|0x00000C5D", "label": "Weapon rack (by the master chest)"},
    {"ref": "ccEEJSSE001-Hstead.esm|0x00000C66", "label": "Mannequin (by the master chest, 2)"},
    {"ref": "ccEEJSSE001-Hstead.esm|0x00000C71", "label": "Mannequin (by the master chest, 3)"},
    {"ref": "ccEEJSSE001-Hstead.esm|0x00000C7F", "label": "Mannequin (by the cellar safe, 3)"},
    {"ref": "ccEEJSSE001-Hstead.esm|0x00000C82", "label": "Right weapon rack (by the cellar safe)"},
    {"ref": "ccEEJSSE001-Hstead.esm|0x00000CA5", "label": "Weapon rack (by the cellar safe, 2)"},
    {"ref": "ccEEJSSE001-Hstead.esm|0x00000CB1", "label": "Weapon rack (by the master chest, 2)"},
    {"ref": "ccEEJSSE001-Hstead.esm|0x00000CB9", "label": "Weapon rack (by the cellar safe, 3)"},
    {"ref": "ccEEJSSE001-Hstead.esm|0x00000CBF", "label": "Weapon rack (by the master chest, 3)"},
    {"ref": "ccEEJSSE001-Hstead.esm|0x00000CC2", "label": "Weapon rack (by the cellar bookcase)"},
    {"ref": "ccEEJSSE001-Hstead.esm|0x00000CC6", "label": "Mannequin (by the cellar bookcase, 3)"},
    {"ref": "ccEEJSSE001-Hstead.esm|0x00000CC8", "label": "Dagger rack (by the master chest, 3)"},
    {"ref": "ccEEJSSE001-Hstead.esm|0x00000CCA", "label": "Right weapon rack (by the cellar bookcase)"},
    {"ref": "ccEEJSSE001-Hstead.esm|0x00000CEC", "label": "Weapon rack (by the cellar bookcase, 2)"},
    {"ref": "ccEEJSSE001-Hstead.esm|0x00000CF5", "label": "Weapon rack (by the cellar bookcase, 3)"},
    {"ref": "ccEEJSSE001-Hstead.esm|0x00000D14", "label": "Mannequin (by the cellar bookcase, 4)"},
    {"ref": "ccEEJSSE001-Hstead.esm|0x00000D22", "label": "Weapon rack (by the master chest, 4)"}
  ]
}
