{
  "$schema": "dovastash-layout-1",
  "name": "Honeyside",
  "note": "Each container takes the item categories listed (see Categories/00_Default.json); ignored ones are never used. Anything without a container of its own goes to the master, the chest. No crafting storage here: ores, hides and other materials go to the master.",
  "author": "Dova Stash",
  "version": "1.0.3",
  "priority": 0,
  "requires": ["Skyrim.esm", "Update.esm", "HearthFires.esm"],
  "conflicts": ["PlayerHouse.esp"],
  "cell": "Skyrim.esm|0x00016BDD",
  "master": "Skyrim.esm|0x000D721E",
  "containers": [
    {"ref": "Skyrim.esm|0x000D7227",      "label": "Kitchen cupboard",                            "categories": ["alchemy.food"]},
    {"ref": "Skyrim.esm|0x000D71FA",      "label": "Lower floor wardrobe (by the alchemy lab)",   "categories": ["alchemy.ingredients", "alchemy.potions", "alchemy.poisons"]},
    {"ref": "Skyrim.esm|0x000D9251",      "label": "Guest bedroom dresser",                       "categories": ["weapons.*", "armor.heavy", "armor.light", "armor.shields"]},
    {"ref": "Skyrim.esm|0x000D71FD",      "label": "Guest bedroom end table",                     "categories": ["ammo.*"]},
    {"ref": "Skyrim.esm|0x000D9278",      "label": "Bedroom wardrobe",                            "categories": ["armor.clothing"]},
    {"ref": "Skyrim.esm|0x000D9243",      "label": "Bedroom night table (by the bed)",            "categories": ["armor.jewelry", "misc.gems", "misc.curios"]},
    {"ref": "Skyrim.esm|0x000D9245",      "label": "Bedroom end table",                           "categories": ["books.*", "scrolls"]},
    {"ref": "Skyrim.esm|0x000D9246",      "label": "Bedroom night table (far side)",              "categories": ["soulgems.*", "keys"]},
    {"ref": "HearthFires.esm|0x00004248", "label": "Chest (by the kitchen cupboard)",             "ignored": true, "note": "Respawns: what you store here can disappear."},
    {"ref": "Skyrim.esm|0x0008DEEA",      "label": "Barrel (by the bedroom wardrobe)",            "ignored": true, "note": "Respawns: what you store here can disappear."},
    {"ref": "Skyrim.esm|0x0008DEEB",      "label": "Barrel (by the bedroom wardrobe, 2)",         "ignored": true, "note": "Respawns: what you store here can disappear."},
    {"ref": "Skyrim.esm|0x0008DEEC",      "label": "Barrel (by the bedroom wardrobe, 3)",         "ignored": true, "note": "Respawns: what you store here can disappear."},
    {"ref": "Skyrim.esm|0x00102BAB",      "label": "Bookshelf (by the lower floor wardrobe)",     "ignored": true, "note": "Scripted bookshelf: it only holds books and hands everything else back."},
    {"ref": "Skyrim.esm|0x00102BC1",      "label": "Bookshelf (by the lower floor wardrobe, 2)",  "ignored": true, "note": "Scripted bookshelf: it only holds books and hands everything else back."},
    {"ref": "Skyrim.esm|0x00102BE9",      "label": "Bookshelf (by the guest bedroom dresser)",    "ignored": true, "note": "Scripted bookshelf: it only holds books and hands everything else back."},
    {"ref": "Skyrim.esm|0x00102BFF",      "label": "Bookshelf (by the guest bedroom dresser, 2)", "ignored": true, "note": "Scripted bookshelf: it only holds books and hands everything else back."}
  ],
  "displays": [
    {"ref": "Skyrim.esm|0x00102BAB", "label": "Bookshelf (by the lower floor wardrobe)"},
    {"ref": "Skyrim.esm|0x00102BC1", "label": "Bookshelf (by the lower floor wardrobe, 2)"},
    {"ref": "Skyrim.esm|0x00102BDA", "label": "Weapon plaque (by the bedroom night table)"},
    {"ref": "Skyrim.esm|0x00102BDF", "label": "Mannequin (by the lower floor wardrobe)"},
    {"ref": "Skyrim.esm|0x00102BE2", "label": "Mannequin (by the lower floor wardrobe, 2)"},
    {"ref": "Skyrim.esm|0x00102BE9", "label": "Bookshelf (by the guest bedroom dresser)"},
    {"ref": "Skyrim.esm|0x00102BFF", "label": "Bookshelf (by the guest bedroom dresser, 2)"},
    {"ref": "Skyrim.esm|0x00102C18", "label": "Weapon plaque (by the kitchen cupboard)"},
    {"ref": "Skyrim.esm|0x00102C1B", "label": "Weapon plaque (by the kitchen cupboard, 2)"},
    {"ref": "Skyrim.esm|0x00102C1E", "label": "Weapon plaque (by the kitchen cupboard, 3)"},
    {"ref": "Skyrim.esm|0x00102C25", "label": "Weapon rack (by the kitchen cupboard)"},
    {"ref": "Skyrim.esm|0x00102C26", "label": "Weapon rack (by the kitchen cupboard, 2)"},
    {"ref": "Skyrim.esm|0x00102C27", "label": "Weapon rack (by the bedroom wardrobe)"},
    {"ref": "Skyrim.esm|0x00102C28", "label": "Weapon rack (by the bedroom wardrobe, 2)"},
    {"ref": "Skyrim.esm|0x00102C2D", "label": "Left weapon rack (by the kitchen cupboard)"},
    {"ref": "Skyrim.esm|0x00102C2E", "label": "Right weapon rack (by the kitchen cupboard)"},
    {"ref": "Skyrim.esm|0x00102C32", "label": "Shield rack (by the kitchen cupboard)"}
  ]
}
