{
  "$schema": "dovastash-layout-1",
  "name": "Tundra Homestead Cellar",
  "author": "Dova Stash",
  "version": "1.0.0",
  "priority": 0,
  "requires": ["Skyrim.esm", "Update.esm", "ccEEJSSE001-Hstead.esm"],
  "cell": "ccEEJSSE001-Hstead.esm|0x00000B06",
  "master": "ccEEJSSE001-Hstead.esm|0x00000F85",
  "containers": [
    {"ref": "ccEEJSSE001-Hstead.esm|0x00000F87", "label": "Cellar safe (by the mannequins)", "categories": ["weapons.*", "ammo.*"]},
    {"ref": "ccEEJSSE001-Hstead.esm|0x00000D1B", "label": "Cellar bookcase (by the mannequin)", "categories": ["books.*"]},
    {"ref": "ccEEJSSE001-Hstead.esm|0x00000D5C", "label": "Cellar bookcase (by the armchair)", "categories": ["armor.heavy", "armor.light", "armor.shields"]},
    {"ref": "ccEEJSSE001-Hstead.esm|0x00000DBB", "label": "Cellar bookcase (by the dragon claws)", "categories": ["misc.gems", "armor.jewelry", "misc.clutter"]},
    {"ref": "ccEEJSSE001-Hstead.esm|0x000009D1", "label": "Book Shelf (scripted bookshelf - only displays books, returns everything else)", "ignored": true},
    {"ref": "ccEEJSSE001-Hstead.esm|0x00000C40", "label": "Book Shelf (scripted bookshelf - only displays books, returns everything else)", "ignored": true}
  ]
}
