{
  "$schema": "dovastash-layout-1",
  "name": "Bloodchill Manor",
  "author": "Dova Stash",
  "version": "1.0.0",
  "priority": 0,
  "requires": ["Skyrim.esm", "Update.esm", "ccEEJSSE005-Cave.esm"],
  "cell": "Update.esm|0x00002FD1",
  "master": "ccEEJSSE005-Cave.esm|0x00038832",
  "containers": [
    {"ref": "ccEEJSSE005-Cave.esm|0x00075884", "label": "Ingot chest (smithy)", "categories": ["misc.ores_ingots"]},
    {"ref": "ccEEJSSE005-Cave.esm|0x00075887", "label": "Ore barrel (smithy)", "categories": ["misc.dwemer"]},
    {"ref": "ccEEJSSE005-Cave.esm|0x000758B4", "label": "Smithy chest (by the smelter)", "categories": ["misc.tools", "misc.building_materials"]},
    {"ref": "ccEEJSSE005-Cave.esm|0x0007589A", "label": "Smithy strong box", "categories": ["misc.gems"]},
    {"ref": "ccEEJSSE005-Cave.esm|0x000758F3", "label": "Armory chest (by the weapon racks)", "categories": ["weapons.*"]},
    {"ref": "ccEEJSSE005-Cave.esm|0x000758B9", "label": "Armory cupboard", "categories": ["ammo.*"]},
    {"ref": "ccEEJSSE005-Cave.esm|0x000758BA", "label": "Armory cupboard (second)", "categories": ["armor.shields"]},
    {"ref": "ccEEJSSE005-Cave.esm|0x00089E7E", "label": "Mannequin room chest", "categories": ["armor.heavy", "armor.light"]},
    {"ref": "ccEEJSSE005-Cave.esm|0x00089F1B", "label": "Enchanting cupboard", "categories": ["soulgems.*"]},
    {"ref": "ccEEJSSE005-Cave.esm|0x00089F28", "label": "Enchanting cupboard (second)", "categories": ["scrolls"]},
    {"ref": "ccEEJSSE005-Cave.esm|0x00089F2E", "label": "Enchanting end table", "categories": ["books.spelltomes"]},
    {"ref": "ccEEJSSE005-Cave.esm|0x00089F29", "label": "Alchemy cupboard", "categories": ["alchemy.ingredients"]},
    {"ref": "ccEEJSSE005-Cave.esm|0x0008F03A", "label": "Alchemy satchel", "categories": ["alchemy.potions", "alchemy.poisons"]},
    {"ref": "ccEEJSSE005-Cave.esm|0x00056FB4", "label": "Kitchen cupboard (by the oven)", "categories": ["alchemy.food"]},
    {"ref": "ccEEJSSE005-Cave.esm|0x0005C1A8", "label": "Library bookcase", "categories": ["books.skill", "books.notes", "books.other"]},
    {"ref": "ccEEJSSE005-Cave.esm|0x00042A70", "label": "Bedroom wardrobe", "categories": ["armor.clothing"]},
    {"ref": "ccEEJSSE005-Cave.esm|0x00084D55", "label": "Safe", "categories": ["armor.jewelry"]},
    {"ref": "ccEEJSSE005-Cave.esm|0x00038831", "label": "Bedroom knapsack", "categories": ["keys"]},
    {"ref": "ccEEJSSE005-Cave.esm|0x00089EFD", "label": "Chest by the dagger rack", "categories": ["misc.hides_pelts", "misc.animal_parts"]},
    {"ref": "ccEEJSSE005-Cave.esm|0x00047BC2", "label": "Fish barrel (by the chopping block)", "categories": ["misc.clutter"]},
    {"ref": "ccEEJSSE005-Cave.esm|0x000612CF", "label": "Book Shelf (scripted bookshelf - only displays books, returns everything else)", "ignored": true},
    {"ref": "ccEEJSSE005-Cave.esm|0x000612D1", "label": "Book Shelf (scripted bookshelf - only displays books, returns everything else)", "ignored": true},
    {"ref": "ccEEJSSE005-Cave.esm|0x000612F4", "label": "Book Shelf (scripted bookshelf - only displays books, returns everything else)", "ignored": true},
    {"ref": "ccEEJSSE005-Cave.esm|0x000612F7", "label": "Book Shelf (scripted bookshelf - only displays books, returns everything else)", "ignored": true},
    {"ref": "ccEEJSSE005-Cave.esm|0x00061317", "label": "Book Shelf (scripted bookshelf - only displays books, returns everything else)", "ignored": true},
    {"ref": "ccEEJSSE005-Cave.esm|0x0006131A", "label": "Book Shelf (scripted bookshelf - only displays books, returns everything else)", "ignored": true},
    {"ref": "ccEEJSSE005-Cave.esm|0x0006B617", "label": "Book Shelf (scripted bookshelf - only displays books, returns everything else)", "ignored": true},
    {"ref": "ccEEJSSE005-Cave.esm|0x0006B618", "label": "Book Shelf (scripted bookshelf - only displays books, returns everything else)", "ignored": true}
  ]
}
