{
  "$schema": "dovastash-layout-1",
  "name": "Shadowfoot Sanctum",
  "note": "Each container takes the item categories listed (see Categories/00_Default.json); ignored ones are never used. Anything without a container of its own goes to the master, the chest.",
  "author": "Dova Stash",
  "version": "1.0.3",
  "priority": 0,
  "requires": ["Skyrim.esm", "Update.esm", "ccEEJSSE003-Hollow.esl"],
  "cell": "Update.esm|0x00002F98",
  "master": "ccEEJSSE003-Hollow.esl|0x00000EB7",
  "containers": [
    {"ref": "ccEEJSSE003-Hollow.esl|0x00000995", "label": "Smithing chest",                           "categories": ["misc.ores_ingots"]},
    {"ref": "ccEEJSSE003-Hollow.esl|0x00000A41", "label": "Barrel (by the tanning rack)",             "categories": ["misc.hides_pelts", "misc.animal_parts"]},
    {"ref": "ccEEJSSE003-Hollow.esl|0x00000B01", "label": "Barrel (by the workbench)",                "categories": ["misc.tools", "misc.building_materials", "misc.dwemer"]},
    {"ref": "ccEEJSSE003-Hollow.esl|0x00000AA7", "label": "Alchemy cupboard",                         "categories": ["alchemy.ingredients"]},
    {"ref": "ccEEJSSE003-Hollow.esl|0x00000D1F", "label": "Alchemy cupboard (second)",                "categories": ["alchemy.potions", "alchemy.poisons"]},
    {"ref": "ccEEJSSE003-Hollow.esl|0x00000E7A", "label": "Enchanting cupboard",                      "categories": ["soulgems.*"]},
    {"ref": "ccEEJSSE003-Hollow.esl|0x00000E7B", "label": "Enchanting cupboard (second)",             "categories": ["scrolls", "books.spelltomes"]},
    {"ref": "ccEEJSSE003-Hollow.esl|0x00000E81", "label": "Weapon rack cupboard",                     "categories": ["weapons.*"]},
    {"ref": "ccEEJSSE003-Hollow.esl|0x00000E82", "label": "Armor cupboard (by the weapon racks)",     "categories": ["armor.heavy", "armor.light", "armor.shields"]},
    {"ref": "ccEEJSSE003-Hollow.esl|0x00000A12", "label": "Bedroom cupboard",                         "categories": ["ammo.*"]},
    {"ref": "ccEEJSSE003-Hollow.esl|0x000009E0", "label": "Kitchen cupboard",                         "categories": ["alchemy.food"]},
    {"ref": "ccEEJSSE003-Hollow.esl|0x00000AF8", "label": "Bedroom safe",                             "categories": ["armor.jewelry", "misc.gems", "misc.curios"]},
    {"ref": "ccEEJSSE003-Hollow.esl|0x00000B07", "label": "Bedroom wardrobe",                         "categories": ["armor.clothing"]},
    {"ref": "ccEEJSSE003-Hollow.esl|0x00000E20", "label": "Bedroom chest",                            "categories": ["keys"]},
    {"ref": "ccEEJSSE003-Hollow.esl|0x00000A5A", "label": "Bookcase (by the shrine)",                 "categories": ["books.skill", "books.notes", "books.other"]},
    {"ref": "ccEEJSSE003-Hollow.esl|0x00000884", "label": "Bookshelf (by the alchemy cupboard)",      "ignored": true, "note": "Scripted bookshelf: it only holds books and hands everything else back."},
    {"ref": "ccEEJSSE003-Hollow.esl|0x00000891", "label": "Bookshelf (by the alchemy cupboard, 2)",   "ignored": true, "note": "Scripted bookshelf: it only holds books and hands everything else back."},
    {"ref": "ccEEJSSE003-Hollow.esl|0x000008C3", "label": "Bookshelf (by the enchanting cupboard)",   "ignored": true, "note": "Scripted bookshelf: it only holds books and hands everything else back."},
    {
      "ref": "ccEEJSSE003-Hollow.esl|0x000008CB",
      "label": "Bookshelf (by the enchanting cupboard, 2)",
      "ignored": true,
      "note": "Scripted bookshelf: it only holds books and hands everything else back."
    },
    {"ref": "ccEEJSSE003-Hollow.esl|0x000009C0", "label": "Test items (by the weapon rack cupboard)", "ignored": true, "note": "Developer test container."}
  ],
  "displays": [
    {"ref": "ccEEJSSE003-Hollow.esl|0x0000085C", "label": "Weapon rack (by the master chest)"},
    {"ref": "ccEEJSSE003-Hollow.esl|0x0000085E", "label": "Weapon rack (by the master chest, 2)"},
    {"ref": "ccEEJSSE003-Hollow.esl|0x00000862", "label": "Weapon rack (by the armor cupboard)"},
    {"ref": "ccEEJSSE003-Hollow.esl|0x00000864", "label": "Weapon rack (by the armor cupboard, 2)"},
    {"ref": "ccEEJSSE003-Hollow.esl|0x00000884", "label": "Bookshelf (by the alchemy cupboard)"},
    {"ref": "ccEEJSSE003-Hollow.esl|0x0000088B", "label": "Weapon rack (by the weapon rack cupboard)"},
    {"ref": "ccEEJSSE003-Hollow.esl|0x00000891", "label": "Bookshelf (by the alchemy cupboard, 2)"},
    {"ref": "ccEEJSSE003-Hollow.esl|0x000008C3", "label": "Bookshelf (by the enchanting cupboard)"},
    {"ref": "ccEEJSSE003-Hollow.esl|0x000008CB", "label": "Bookshelf (by the enchanting cupboard, 2)"},
    {"ref": "ccEEJSSE003-Hollow.esl|0x000008D6", "label": "Weapon rack (by the weapon rack cupboard, 2)"},
    {"ref": "ccEEJSSE003-Hollow.esl|0x000008D8", "label": "Weapon rack (by the armor cupboard, 3)"},
    {"ref": "ccEEJSSE003-Hollow.esl|0x000008D9", "label": "Weapon rack (by the weapon rack cupboard, 3)"},
    {"ref": "ccEEJSSE003-Hollow.esl|0x000008DC", "label": "Weapon rack (by the alchemy cupboard)"},
    {"ref": "ccEEJSSE003-Hollow.esl|0x000008F1", "label": "Weapon rack (by the alchemy cupboard, 2)"},
    {"ref": "ccEEJSSE003-Hollow.esl|0x00000AFB", "label": "Shield rack (by the master chest)"},
    {"ref": "ccEEJSSE003-Hollow.esl|0x00000E9A", "label": "Mannequin (by the master chest)"},
    {"ref": "ccEEJSSE003-Hollow.esl|0x00000E9B", "label": "Mannequin (by the armor cupboard)"},
    {"ref": "ccEEJSSE003-Hollow.esl|0x00000E9C", "label": "Shield rack (by the armor cupboard)"},
    {"ref": "ccEEJSSE003-Hollow.esl|0x00000EA9", "label": "Mannequin (by the weapon rack cupboard)"},
    {"ref": "ccEEJSSE003-Hollow.esl|0x00000EBC", "label": "Mannequin (by the weapon rack cupboard, 2)"},
    {"ref": "ccEEJSSE003-Hollow.esl|0x00000EC3", "label": "Mannequin (by the armor cupboard, 2)"},
    {"ref": "ccEEJSSE003-Hollow.esl|0x00000EC4", "label": "Mannequin (by the armor cupboard, 3)"},
    {"ref": "ccEEJSSE003-Hollow.esl|0x00000EC6", "label": "Mannequin (by the alchemy cupboard)"},
    {"ref": "ccEEJSSE003-Hollow.esl|0x00000ECA", "label": "Mannequin (by the alchemy cupboard, 2)"},
    {"ref": "ccEEJSSE003-Hollow.esl|0x00000ED2", "label": "Mannequin (by the master chest, 2)"},
    {"ref": "ccEEJSSE003-Hollow.esl|0x00000ED6", "label": "Mannequin (by the master chest, 3)"},
    {"ref": "ccEEJSSE003-Hollow.esl|0x00000EDB", "label": "Mannequin (by the alchemy cupboard, 3)"},
    {"ref": "ccEEJSSE003-Hollow.esl|0x00000EDE", "label": "Weapon rack (by the master chest, 3)"},
    {"ref": "ccEEJSSE003-Hollow.esl|0x00000EE0", "label": "Mannequin (by the weapon rack cupboard, 3)"},
    {"ref": "ccEEJSSE003-Hollow.esl|0x00000EE2", "label": "Mannequin (by the master chest, 4)"},
    {"ref": "ccEEJSSE003-Hollow.esl|0x00000EE7", "label": "Mannequin (by the enchanting cupboard)"},
    {"ref": "ccEEJSSE003-Hollow.esl|0x00000EE9", "label": "Weapon rack (by the alchemy cupboard, 3)"},
    {"ref": "ccEEJSSE003-Hollow.esl|0x00000EEA", "label": "Weapon rack (by the master chest, 4)"},
    {"ref": "ccEEJSSE003-Hollow.esl|0x00000EEB", "label": "Mannequin (by the master chest, 5)"},
    {"ref": "ccEEJSSE003-Hollow.esl|0x00000EEC", "label": "Weapon rack (by the enchanting cupboard)"},
    {"ref": "ccEEJSSE003-Hollow.esl|0x00000EEE", "label": "Weapon rack (by the enchanting cupboard, 2)"},
    {"ref": "ccEEJSSE003-Hollow.esl|0x00000EF0", "label": "Weapon rack (by the master chest, 5)"},
    {"ref": "ccEEJSSE003-Hollow.esl|0x00000EF4", "label": "Weapon rack (by the enchanting cupboard, 3)"},
    {"ref": "ccEEJSSE003-Hollow.esl|0x00000EF6", "label": "Shield rack (by the armor cupboard, 2)"},
    {"ref": "ccEEJSSE003-Hollow.esl|0x00000EF9", "label": "Weapon rack (by the armor cupboard, 4)"},
    {"ref": "ccEEJSSE003-Hollow.esl|0x00000EFB", "label": "Shield rack (by the armor cupboard, 3)"},
    {"ref": "ccEEJSSE003-Hollow.esl|0x00000EFD", "label": "Mannequin (by the master chest, 6)"},
    {"ref": "ccEEJSSE003-Hollow.esl|0x00000F03", "label": "Weapon rack (by the master chest, 6)"},
    {"ref": "ccEEJSSE003-Hollow.esl|0x00000F0A", "label": "Shield rack (by the master chest, 2)"},
    {"ref": "ccEEJSSE003-Hollow.esl|0x00000F0B", "label": "Weapon rack (by the master chest, 7)"},
    {"ref": "ccEEJSSE003-Hollow.esl|0x00000F0C", "label": "Mannequin (by the enchanting cupboard, 2)"},
    {"ref": "ccEEJSSE003-Hollow.esl|0x00000F0F", "label": "Shield rack (by the master chest, 3)"},
    {"ref": "ccEEJSSE003-Hollow.esl|0x00000F10", "label": "Mannequin (by the enchanting cupboard, 3)"},
    {"ref": "ccEEJSSE003-Hollow.esl|0x00000F69", "label": "Mannequin (by the master chest, 7)"},
    {"ref": "ccEEJSSE003-Hollow.esl|0x00000F9F", "label": "Shield rack (by the weapon rack cupboard)"},
    {"ref": "ccEEJSSE003-Hollow.esl|0x00000FA1", "label": "Shield rack (by the weapon rack cupboard, 2)"},
    {"ref": "ccEEJSSE003-Hollow.esl|0x00000FA3", "label": "Shield rack (by the weapon rack cupboard, 3)"},
    {"ref": "ccEEJSSE003-Hollow.esl|0x00000FA5", "label": "Shield rack (by the alchemy cupboard)"},
    {"ref": "ccEEJSSE003-Hollow.esl|0x00000FA9", "label": "Shield rack (by the alchemy cupboard, 2)"},
    {"ref": "ccEEJSSE003-Hollow.esl|0x00000FAA", "label": "Shield rack (by the alchemy cupboard, 3)"},
    {"ref": "ccEEJSSE003-Hollow.esl|0x00000FAC", "label": "Shield rack (by the master chest, 4)"},
    {"ref": "ccEEJSSE003-Hollow.esl|0x00000FB0", "label": "Shield rack (by the master chest, 5)"},
    {"ref": "ccEEJSSE003-Hollow.esl|0x00000FB1", "label": "Shield rack (by the master chest, 6)"}
  ]
}
