{
  "$schema": "dovastash-layout-1",
  "name": "Winter Cove (AutoTest)",
  "note": "AutoTest template: every cell of the home and its containers as the editor drafted them (cells of the home's own plugin only).",
  "author": "Dova Stash AutoTest",
  "version": "1.0.0",
  "priority": 10,
  "requires": [
    "Winter Cove.esp"
  ],
  "cell": "Winter Cove.esp|0x00000D62",
  "cells": [
    {
      "cell": "Winter Cove.esp|0x0000E30B",
      "label": "Winter Cove storage"
    }
  ],
  "master": "Winter Cove.esp|0x000216D8",
  "containers": [
    {
      "ref": "Winter Cove.esp|0x0000E318",
      "label": "Beverages"
    },
    {
      "ref": "Winter Cove.esp|0x0000E31A",
      "label": "Raw Meat"
    },
    {
      "ref": "Winter Cove.esp|0x0000E31B",
      "label": "Food",
      "categories": [
        "alchemy.food"
      ]
    },
    {
      "ref": "Winter Cove.esp|0x0000E31C",
      "label": "Firewood",
      "categories": [
        "misc.building_materials"
      ]
    },
    {
      "ref": "Winter Cove.esp|0x0000E31D",
      "label": "Books",
      "categories": [
        "books.*",
        "books.other"
      ]
    },
    {
      "ref": "Winter Cove.esp|0x0000E31E",
      "label": "Vegetables"
    },
    {
      "ref": "Winter Cove.esp|0x0000E328",
      "label": "Potions & Poisons",
      "categories": [
        "alchemy.poisons",
        "alchemy.potions"
      ]
    },
    {
      "ref": "Winter Cove.esp|0x0000E329",
      "label": "Ingredients",
      "categories": [
        "alchemy.ingredients"
      ]
    },
    {
      "ref": "Winter Cove.esp|0x00012A7C",
      "label": "Scrolls",
      "categories": [
        "scrolls"
      ]
    },
    {
      "ref": "Winter Cove.esp|0x00012A7D",
      "label": "Keys",
      "categories": [
        "keys"
      ]
    },
    {
      "ref": "Winter Cove.esp|0x00012A7E",
      "label": "Armors",
      "categories": [
        "armor.*",
        "armor.heavy",
        "armor.light"
      ]
    },
    {
      "ref": "Winter Cove.esp|0x00012A7F",
      "label": "Shields",
      "categories": [
        "armor.shields"
      ]
    },
    {
      "ref": "Winter Cove.esp|0x000216D3",
      "label": "Notes, Letters & Jounals",
      "categories": [
        "books.notes"
      ]
    },
    {
      "ref": "Winter Cove.esp|0x000216D4",
      "label": "Weapons",
      "categories": [
        "weapons.*"
      ]
    },
    {
      "ref": "Winter Cove.esp|0x000216D5",
      "label": "Ingots",
      "categories": [
        "misc.ores_ingots"
      ]
    },
    {
      "ref": "Winter Cove.esp|0x000216D6",
      "label": "Ores"
    },
    {
      "ref": "Winter Cove.esp|0x000216D7",
      "label": "Leather & Strips",
      "categories": [
        "misc.hides_pelts"
      ]
    }
  ]
}